{
  "topic_id": "system-toilet-sheets-2026-08-09",
  "topic": "猫用システムトイレ専用シート",
  "researched_at": "2026-08-09",
  "status": "verified_initial_research",
  "policy": {
    "raw_review_text_stored": false,
    "compatibility": "各メーカーの専用トイレ・専用シートの組み合わせを基本とし、寸法だけで他社互換を推奨しない",
    "review_use": "レビュー原文は保存せず、吸収・消臭・交換頻度・扱いやすさの共通傾向のみ要約"
  },
  "products": [
    {
      "id": "deotoilet-deodorizing-antibacterial-sheet-10",
      "name": "デオトイレ 消臭・抗菌シート 10枚",
      "brand": "デオトイレ",
      "maker": "ユニ・チャーム",
      "official_source": "https://jp.unicharmpet.com/ja/products/cat/toiletcare-deotoilet-4520699613443.html",
      "official_facts": [
        "4枚・10枚・20枚の容量展開",
        "愛猫1頭（体重8kgまで）のデオトイレ使用時に1週間分の尿を吸収する目安",
        "銀イオン配合でニオイ菌99.9%抑制を訴求（規定試験、すべての菌を抑制するわけではない）",
        "消臭マイクロカプセル配合",
        "白色シートで尿色を確認しやすい"
      ],
      "review_source": "https://review.rakuten.co.jp/review/item/1/261122_10057695/1.1/",
      "review_snapshot": {"rating": 4.66, "count": 184, "scope": "楽天24 10枚入", "checked_at": "2026-08-09"},
      "usage_trends": [
        "吸収力と消臭を評価する声が多い",
        "1週間単位で交換できる手軽さを評価する利用者がいる",
        "長期継続利用のレビューが多い"
      ],
      "tradeoffs": [
        "専用品のため価格を高く感じる声がある",
        "尿量が多い猫や複数飼育では交換時期を早める必要がある"
      ],
      "evidence_strength": "high"
    },
    {
      "id": "nyantomo-deodorizing-antibacterial-sheet-12",
      "name": "ニャンとも清潔トイレ 脱臭・抗菌シート 12枚",
      "brand": "ニャンとも清潔トイレ",
      "maker": "エステー",
      "official_source": "https://products.st-c.co.jp/detail/16149/",
      "official_facts": [
        "12枚・8枚・4枚の容量展開",
        "愛猫1頭の場合は1枚で約1週間、2頭の場合は約3〜4日が交換目安",
        "抗菌脱臭・中和脱臭・吸着脱臭の3つの脱臭パワーを訴求",
        "白色シートで尿色を確認しやすい",
        "水洗トイレには流さず、自治体ルールに従って廃棄"
      ],
      "review_source": "https://review.rakuten.co.jp/item/1/261122_11282333/1.1/",
      "review_snapshot": {"rating": 4.63, "count": 8, "scope": "楽天24 12枚入", "checked_at": "2026-08-09"},
      "additional_review_context": {"rating": 4.76, "count": 142, "scope": "楽天商品価格ナビ 12枚入", "checked_at": "2026-08-09"},
      "usage_trends": [
        "吸収力と専用サイズの使いやすさを評価する声がある",
        "交換回数を減らせる点を評価する利用者がいる",
        "継続利用のレビューが確認できる"
      ],
      "tradeoffs": [
        "楽天24単品レビューの母数は8件と小さい",
        "尿量や頭数によって公式目安より早い交換が必要になる"
      ],
      "evidence_strength": "medium_high"
    }
  ],
  "editorial_conclusion": {
    "overall_winner": null,
    "reason": "両製品とも各ブランドのシステムトイレ用専用品であり、まず本体との組み合わせを優先すべき。レビュー母数も異なるため平均点の単純順位は付けない",
    "use_case_winners": [
      {"label": "デオトイレ本体ユーザー", "product_id": "deotoilet-deodorizing-antibacterial-sheet-10"},
      {"label": "ニャンとも清潔トイレ本体ユーザー", "product_id": "nyantomo-deodorizing-antibacterial-sheet-12"},
      {"label": "レビュー母数重視", "product_id": "deotoilet-deodorizing-antibacterial-sheet-10"}
    ]
  }
}
